[
  {
    "faction_id": "meg",
    "display_name": "M.E.G.",
    "role": "Research, safety, archive, scanner play",
    "starting_items": [
      "tool_meg_entity_scanner",
      "item_flashlight"
    ],
    "hub_upgrade_focus": [
      "ArchiveTerminal",
      "ScannerLab",
      "MedicalBay",
      "SecurityCheckpoint"
    ],
    "description": "Research and preservation faction focused on mapping, safety, and entity documentation."
  },
  {
    "faction_id": "bntg",
    "display_name": "B.N.T.G.",
    "role": "Trade, salvage, economy, armor/resources",
    "starting_items": [
      "tool_bntg_salvage_kit",
      "item_flashlight"
    ],
    "hub_upgrade_focus": [
      "TraderMarket",
      "TicketExchange",
      "SharedArmory",
      "Workshop"
    ],
    "description": "Trade and salvage faction focused on resources, shops, and armor access."
  },
  {
    "faction_id": "clippers",
    "display_name": "Clippers",
    "role": "Runner/scout/no-clip route faction",
    "starting_items": [
      "tool_clippers_camcorder",
      "item_flashlight"
    ],
    "hub_upgrade_focus": [
      "RouteWall",
      "TapeBoard",
      "ChalkNetwork",
      "ShortcutDen"
    ],
    "description": "Runners who survive by recording routes, marking paths, and finding exits before the rooms shift."
  }
]
